{
  "packet_version": 2,
  "market_date": "2026-10-28",
  "session": {
    "timezone": "America/New_York",
    "regular_open_utc": "2026-10-28T13:30:00+00:00",
    "regular_close_utc": "2026-10-28T20:00:00+00:00",
    "previous_session_close_utc": "2026-10-27T20:00:00+00:00"
  },
  "market_context": {},
  "movers": [],
  "peer_groups": [],
  "evidence": [
    {
      "title": "Synthetic company announces contract",
      "original_url": "https://example.com/article",
      "publisher": "Synthetic Publisher",
      "published_at": "2026-10-28T15:00:00Z",
      "publication_timestamp_original": "2026-10-28T15:00:00Z",
      "publication_precision": "TIMESTAMP",
      "retrieved_at": null,
      "symbols": [],
      "source_text": "Synthetic company announced a contract.",
      "content_completeness": "EXCERPT",
      "source_category": "NEWS",
      "provider_limitations": [],
      "filing_metadata": {},
      "source_provider": "finnhub",
      "acquisition_method": "RECORDED_PROVIDER_RESPONSE",
      "normalized_url": "https://example.com/article",
      "temporal_tag": "REGULAR_SESSION",
      "evidence_id": "ev_fa1db9e496011efa206368fcf53037aeb6af130f270620d701c6c4cdc7db26cf"
    }
  ],
  "coverage": [
    {
      "provider": "finnhub",
      "state": "AVAILABLE",
      "limitations": [],
      "accepted": 1,
      "excluded": 0,
      "budget_excluded": 0,
      "incomplete": 1
    }
  ],
  "diagnostics": {
    "hygiene_rejections": {},
    "live_requests": 0,
    "origin": "SYNTHETIC_TEST_FIXTURE_NOT_ARCHIVED_REPORT"
  }
}